{
  "id": "covert_works",
  "name": "Covert Works",
  "category": "Production",
  "populationCost": 1,

  "notes": "Signal Ridge only. Unlocks, in order: Ghost Tank, Repair Truck, Disruptor.",

  "productionUpgradeLevels": [
    { "level": 1, "hp": 210, "unlocks": "ghost_tank", "cost": { "stone": 150, "steel": 90 } },
    { "level": 2, "hp": 245, "unlocks": "repair_truck", "cost": { "stone": 250, "steel": 200 } },
    { "level": 3, "hp": 290, "unlocks": "disruptor", "cost": { "stone": 400, "steel": 300 } }
  ]
}
