{
  "id": "water_turret",
  "name": "Water Turret",
  "category": "Defensive",
  "populationCost": 1,

  "materials": ["stone", "wood", "steel"],

  "notes": "Shared specialty water-cannon defense that trades air targeting for a strong bonus against ships — effective at the waterline but hard to aim skyward. Must be placed next to water to cover a crossing or coastline. Comes in several material variants: a balanced baseline, a cheap, fast, fragile option suited to spamming against small raids, and a pricier, tankier option that splashes on hit and lands the heaviest per-hit naval bonus, built to punish a grouped push.",

  "placementRequirement": {
    "adjacentTerrainRequired": "Water"
  },

  "defensiveStats": {
    "projectileSpeed": 10
  },

  "materialStats": {
    "stone": {
      "baseStats": { "hp": 250, "damage": 16, "attackSpeed": 1.2, "range": 4, "visionRange": 8 },
      "statGrowth": {
        "hp": { "mode": "percent", "value": 12 },
        "damage": { "mode": "percent", "value": 10 },
        "attackSpeed": { "mode": "flat", "value": 0 },
        "range": { "mode": "flat", "value": 0.5 },
        "visionRange": { "mode": "flat", "value": 0.5 }
      },
      "baseCost": { "stone": 140 },
      "costGrowth": { "mode": "percent", "value": 25 },
      "canTarget": ["Infantry", "Land", "Naval"],
      "damageTypes": [],
      "splashRadius": 0,
      "damageDealtModifiers": { "Naval": 2.5 }
    },
    "wood": {
      "baseStats": { "hp": 150, "damage": 10, "attackSpeed": 1.6, "range": 4, "visionRange": 8 },
      "statGrowth": {
        "hp": { "mode": "percent", "value": 15 },
        "damage": { "mode": "flat", "value": 1 },
        "attackSpeed": { "mode": "flat", "value": 0 },
        "range": { "mode": "flat", "value": 0 },
        "visionRange": { "mode": "flat", "value": 0 }
      },
      "baseCost": { "wood": 70 },
      "costGrowth": { "mode": "percent", "value": 20 },
      "canTarget": ["Infantry", "Land", "Naval"],
      "damageTypes": [],
      "splashRadius": 0,
      "damageDealtModifiers": { "Naval": 1.5 },
      "damageReceivedModifiers": { "Fire": 2.0 }
    },
    "steel": {
      "baseStats": { "hp": 350, "armor": 3, "damage": 15, "attackSpeed": 0.9, "range": 4, "visionRange": 8 },
      "statGrowth": {
        "hp": { "mode": "percent", "value": 10 },
        "armor": { "mode": "flat", "value": 0 },
        "damage": { "mode": "percent", "value": 8 },
        "attackSpeed": { "mode": "flat", "value": 0 },
        "range": { "mode": "flat", "value": 0 },
        "visionRange": { "mode": "flat", "value": 0 }
      },
      "baseCost": { "steel": 180 },
      "costGrowth": { "mode": "percent", "value": 25 },
      "canTarget": ["Infantry", "Land", "Naval"],
      "damageTypes": [],
      "splashRadius": 2,
      "damageDealtModifiers": { "Naval": 2.0 }
    }
  }
}
