{
  "id": "wall",
  "name": "Wall",
  "category": "Defensive",
  "populationCost": 0,

  "materials": ["wood", "stone", "steel"],

  "notes": "Sits on the border between two hexes rather than on a hex itself, blocking movement and line-of-sight/projectiles across that edge; aircraft ignore it entirely. Never attacks — a purely passive barrier. Comes in a cheap, fragile, fire-vulnerable material, a balanced middle option, and a pricier option with flat damage reduction. A destroyed wall disappears outright rather than leaving a discounted ruin to rebuild from.",

  "materialStats": {
    "wood": {
      "baseStats": { "hp": 80 },
      "statGrowth": { "hp": { "mode": "percent", "value": 10 } },
      "baseCost": { "wood": 15 },
      "costGrowth": { "mode": "percent", "value": 20 },
      "damageReceivedModifiers": { "Fire": 2.0 }
    },
    "stone": {
      "baseStats": { "hp": 200 },
      "statGrowth": { "hp": { "mode": "percent", "value": 12 } },
      "baseCost": { "stone": 40 },
      "costGrowth": { "mode": "percent", "value": 22 },
      "damageReceivedModifiers": {}
    },
    "steel": {
      "baseStats": { "hp": 400, "armor": 5 },
      "statGrowth": { "hp": { "mode": "percent", "value": 15 }, "armor": { "mode": "flat", "value": 0 } },
      "baseCost": { "steel": 70 },
      "costGrowth": { "mode": "percent", "value": 25 },
      "damageReceivedModifiers": {}
    }
  }
}
