{
  "id": "demolition_plant",
  "name": "Demolition Plant",
  "category": "Production",
  "populationCost": 1,

  "notes": "Camp Kaboom's only combat-troop production building — a dedicated heavy-artillery pair (Tank Obliterator's rail gun, Earthshaker's splash siege) found nowhere else in the roster. Camp Kaboom has no Barracks/Factory, so this is also its only source of any troops at all.",

  "productionUpgradeLevels": [
    { "level": 1, "hp": 430, "unlocks": "tank_obliterator", "cost": { "stone": 780, "steel": 620 } },
    { "level": 2, "hp": 660, "unlocks": "earthshaker", "cost": { "stone": 1300, "steel": 900 } }
  ]
}
