{
  "id": "farm",
  "name": "Farm",
  "category": "Resource",
  "populationCost": 1,

  "notes": "Basic food-producing building present at every base from the start. Losing it doesn't block rebuilding more.",

  "nonProductionUpgrade": {
    "baseStats": {
      "hp": 150,
      "foodOutput": 5
    },
    "statGrowth": {
      "hp": { "mode": "percent", "value": 10 },
      "foodOutput": { "mode": "percent", "value": 8 }
    },
    "baseCost": {
      "stone": 50
    },
    "costGrowth": { "mode": "percent", "value": 25 }
  }
}
