{
  "id": "emp_turret",
  "name": "EMP Turret",
  "category": "Defensive",
  "populationCost": 1,
  "extends": "turret",

  "notes": "A Turret variant (see \"extends\") built around its statusEffectOnHit rather than raw damage — low base damage, but every hit applies `{type: emp, duration: 3}` (see game-design/05-troop-stat-schema.md's Status Effects section for the full domain-conditional breakdown): Land-domain vehicles are immobilized (can't move, can still attack) for the duration; Air-domain troops are destroyed outright; Infantry and Naval are unaffected by the status (still take direct damage normally); troops flagged empImmune (Hot Air Balloon, Glider) are unaffected entirely. canTarget restates Turret's full four domains (Infantry/Land/Naval/Air) since the status effect is meaningfully defined against all four — fixed from an earlier authoring gap where this block omitted canTarget entirely and, per schema.json's extends rule (defensiveStats overrides the base wholesale, not merged key-by-key), left this Turret unable to target anything.",

  "defensiveStats": {
    "damage": 6,
    "attackSpeed": 0.8,
    "range": 5,
    "splashRadius": 3,
    "canTarget": ["Infantry", "Land", "Naval", "Air"],
    "visionRange": 6,
    "statusEffectOnHit": { "type": "emp", "duration": 3 }
  },

  "nonProductionUpgrade": {
    "baseStats": {
      "hp": 200,
      "damage": 6,
      "range": 5
    },
    "statGrowth": {
      "hp": { "mode": "percent", "value": 12 },
      "damage": { "mode": "percent", "value": 10 },
      "range": { "mode": "flat", "value": 0.3 }
    },
    "baseCost": {
      "stone": 110,
      "steel": 70
    },
    "costGrowth": { "mode": "percent", "value": 25 }
  }
}
