{
  "id": "ford_yard",
  "name": "Ford Yard",
  "category": "Production",
  "populationCost": 1,

  "placementRequirement": {
    "siteTerrain": "Plains",
    "adjacentTerrainRequired": "Water"
  },

  "notes": "Rivergate only — Water-adjacency covers Ocean or River tiles alike, same requirement as Port/Shipyard. Unlocks, in order: Amphibious Raider, Submarine.",

  "productionUpgradeLevels": [
    { "level": 1, "hp": 220, "unlocks": "amphibious_raider", "cost": { "stone": 200, "steel": 120 } },
    { "level": 2, "hp": 280, "unlocks": "submarine", "cost": { "stone": 300, "steel": 300 } }
  ]
}
