{
  "id": "command_centre",
  "name": "Command Centre",
  "category": "Production",
  "isFixed": true,
  "populationCost": 1,

  "notes": "Trains command units. Permanent once established — never freshly built, and cannot be torn down, only restored from ruin if destroyed.",

  "commanderProgression": {
    "tierLevels": [
      { "level": 1, "unlocksTier": "common", "commanderSlots": 1, "hp": 250, "cost": { "stone": 300, "steel": 150 } },
      { "level": 2, "unlocksTier": "rare", "commanderSlots": 1, "hp": 290, "cost": { "stone": 500, "steel": 230 } },
      { "level": 3, "unlocksTier": "epic", "commanderSlots": 1, "hp": 335, "cost": { "stone": 800, "steel": 320 } }
    ],
    "postTierGrowth": {
      "hpGrowth": { "mode": "percent", "value": 10 },
      "commanderSlotsPerLevel": 1,
      "costGrowth": { "mode": "percent", "value": 25 }
    }
  }
}
