{
  "id": "forest_yard",
  "name": "Forest Yard",
  "category": "Production",
  "populationCost": 1,

  "placementRequirement": {
    "siteTerrain": "Forest"
  },

  "notes": "Specialist production building sited directly on forest terrain, producing a fast, lightweight scout vehicle able to cross terrain other land vehicles can't.",

  "productionUpgradeLevels": [
    { "level": 1, "hp": 190, "unlocks": "quad_bike", "cost": { "stone": 180, "steel": 60 } }
  ]
}
