{
  "id": "oil_rig",
  "name": "Oil Rig",
  "category": "Resource",
  "populationCost": 1,

  "notes": "Fuel-producing building with an identical build cost at every base — any production bonus or penalty for it comes from base-specific modifiers rather than the building itself.",

  "nonProductionUpgrade": {
    "baseStats": {
      "hp": 150,
      "fuelOutput": 4
    },
    "statGrowth": {
      "hp": { "mode": "percent", "value": 10 },
      "fuelOutput": { "mode": "percent", "value": 10 }
    },
    "baseCost": {
      "stone": 60,
      "steel": 30
    },
    "costGrowth": { "mode": "percent", "value": 25 }
  }
}
