{
  "id": "iron_aviary",
  "name": "Iron Aviary",
  "category": "Production",
  "populationCost": 1,

  "notes": "Sky Fortress only — the pure air-combat counterpart to Windy Peaks' Wind Sanctuary. No terrain exception; sited on Plains. Unlocks, in order: Wingfighter and Thunder.",

  "productionUpgradeLevels": [
    { "level": 1, "hp": 220, "unlocks": "wingfighter", "cost": { "stone": 90, "steel": 70 } },
    { "level": 2, "hp": 255, "unlocks": "thunder", "cost": { "stone": 140, "steel": 110 } }
  ]
}
