{
  "id": "turret",
  "name": "Turret",
  "category": "Defensive",
  "populationCost": 1,

  "notes": "Generic default defense buildable at every base, and the base pattern several specialty defenses are built from.",

  "defensiveStats": {
    "damage": 18,
    "attackSpeed": 1.0,
    "range": 4,
    "splashRadius": 0,
    "projectileSpeed": 12,
    "canTarget": ["Infantry", "Land", "Naval", "Air"],
    "damageTypes": [],
    "visionRange": 7
  },

  "nonProductionUpgrade": {
    "baseStats": {
      "hp": 250,
      "damage": 18,
      "range": 4
    },
    "statGrowth": {
      "hp": { "mode": "percent", "value": 12 },
      "damage": { "mode": "percent", "value": 10 },
      "range": { "mode": "flat", "value": 0.5 }
    },
    "baseCost": {
      "stone": 140,
      "steel": 30
    },
    "costGrowth": { "mode": "percent", "value": 25 }
  }
}
