{
  "id": "quarry",
  "name": "Quarry",
  "category": "Resource",
  "populationCost": 1,

  "notes": "Steel-producing building, present at every base from the start. Deliberately priced in a different resource than the one it produces, avoiding a chicken-and-egg problem for a base's very first construction.",

  "nonProductionUpgrade": {
    "baseStats": {
      "hp": 180,
      "stoneOutput": 4
    },
    "statGrowth": {
      "hp": { "mode": "percent", "value": 10 },
      "stoneOutput": { "mode": "percent", "value": 10 }
    },
    "baseCost": {
      "steel": 40
    },
    "costGrowth": { "mode": "percent", "value": 30 }
  }
}
