{
  "id": "wind_spire",
  "name": "Wind Spire",
  "category": "Defensive",
  "populationCost": 1,
  "extends": "turret",

  "placementRequirement": {
    "siteTerrain": "Hill"
  },

  "notes": "Specialty hill-sited defense that trades raw single-target damage for crowd control and a strong anti-air bonus: rather than converging on one point like a normal turret, it blasts a gust of wind outward in a straight line, damaging and knocking back everything caught downwind. Damage and attack speed are both lower than the generic defense to pay for hitting an entire line at once. Longer range than the generic defense, reflecting its elevated position.",

  "defensiveStats": {
    "damage": 4,
    "attackSpeed": 0.6,
    "range": 6,
    "splashRadius": 0,
    "lineAttack": true,
    "projectileSpeed": 4,
    "canTarget": ["Infantry", "Land", "Air"],
    "damageTypes": [],
    "visionRange": 8,
    "damageDealtModifiers": { "Air": 2.5 , "Land": 0.5},
    "statusEffectOnHit": { "type": "knockback", "magnitude": 2 }
  },

  "nonProductionUpgrade": {
    "baseStats": {
      "hp": 210,
      "damage": 4,
      "range": 6
    },
    "statGrowth": {
      "hp": { "mode": "percent", "value": 12 },
      "damage": { "mode": "percent", "value": 10 },
      "range": { "mode": "flat", "value": 0.5 }
    },
    "baseCost": {
      "stone": 90,
      "steel": 50
    },
    "costGrowth": { "mode": "percent", "value": 25 }
  }
}
